'Ông chú Pokemon' cưỡi xe đạp gắn 23 chiếc smartphone,chen san-yuan hơn 70 tuổi là huấn luyện viên của game pokemon go nổi tiếng toàn thế giới năm ngoái ông gây chú ý khi thường đạp chiếc xe đã được tùy chỉnh để gắn 11 chiếc smartphone trên đường phố đài bắc đài loan để bắt pokemon ông được nhiều người dùng internet đặt cho biệt danh thân mật là ông chú pokemontheo soranews24 hôm 9/3 một người dùng twitter đã đăng tải hình ảnh mới về game thủ pokemon go kỳ cựu này điều đặc biệt là chiếc xe đạp quen thuộc của ông đã được tiến hóa để có thể gắn theo 21 chiếc điện thoại thông minh cùng với 2 chiếc đặt trong gió xe số lượng smartphone mà game thủ cao tuổi này luôn mang theo người để chơi cùng lúc đã tăng lên con số 23chen san-yuan bắt đầu chơi game pokemon go từ năm 2016 khi trò chơi này mới ra mắt và trở nên phổ biến ở đài loan tình yêu của ông dành cho trò chơi di động này ngày càng lớn tới mức một chiếc smartphone không thể chứa hết đo là lý do ông bắt đầu tăng số lượng thiết bị của mình ngày càng nhiều lên trong một chia sẻ với báo giới ông cho biết khi một tài khoản game của mình vượt quá cấp 30 nó sẽ có một vị trí trên pokebike tên gọi riêng của chiếc xe đạp mà ông hay sử dụng để đi bắt pokemontheo nhiều game thủ sự tăng trưởng đột biến về số lượng smartphone của ông chú pokemon có liên quan trực tiếp tới chế độ đánh boss trong game cho phép người chơi có thể hợp tác với nhau để nhận các loại pokemon siêu mạnh cũng như lượng lớn điểm kinh nghiệm trò chơi cho phép tối đa 20 người tham gia cùng lúc ở chế độ này với 23 tài khoản ông chú pokemon có thể tự mình đánh boss và sử dụng tất cả điện thoại cùng lúc tuy nhiên video quay lại cảnh đánh boss cho thấy ông dường như chỉ có thể xoay xở với khoảng 7 tới 8 thiết bịnhiều người dùng tỏ ra ấn tượng và bất ngờ với sự nhiệt huyết và đam mê của ông chú pokemon video chia sẻ trên twitter đã nhận được hơn 3 triệu lượt xem có người so sánh cách ông chơi game như đang đánh đànđây giống cảnh một người đang sống cùng với 40 con mèo lần trước tôi thấy ông ấy chỉ có khoảng 12 chiếc điện thoại ông ấy đang điều khiển pokemon hay ngược lại? đúng là một bậc thầy về pokemon là các bình luận quen thuộc của người dùng trên internet về ôngtrên thực tế nhà phát triển game niantic cấm việc một người chơi cùng lúc nhiều tài khoản năm ngoái họ đã ban hành lệnh cấm game 30 ngày với một huấn luyện viên pokemon nổi tiếng người chuyên cung cấp dịch vụ tăng cấp cho tài khoản của người kháctuy nhiên do ông chú pokemon dường như không phải chơi vì mục đích kinh doanh nên các tài khoản của ông không bị ảnh hưởng bản thân chen cũng tuyên bố ông chơi game với mục đích ngăn chặn sự lão hóa của bản thân dẫu vậy không ít người cũng lo ngại cho vấn đề sức khỏe của ông bởi việc điều khiển một chiếc xe đạp gắn quá nhiều điện thoại để di chuyển trên đường phố có thể khiến game thủ cao tuổi này gặp nhiều nguy hiểm
Facebook 'sập' trên toàn cầu,chỉ khoảng một giờ sau khi người dùng phản ánh facebook đã lên tiếng thông qua twitter khẳng định vấn đề không liên quan tới tấn công từ chối dịch vụ ddos và đang nỗ lực khắc phục sớm nhất có thểhôm qua 13/3 hàng nghìn người cũng phàn nàn trên mạng xã hội khi không thể mở gmail và google drive google cho biết gmail và google drive bị gián đoạn dịch vụ người dùng có thể truy cập nhưng sẽ thấy thông báo lỗi độ trễ cao và họ đang xem xét vấn đề
Đa số ứng dụng diệt virus trên Google Play vô dụng,theo nghiên cứu được thực hiện bởi av-comparatives một công ty chuyên thử nghiệm phần mềm chống virus trụ sở tại áo tỷ lệ ứng dụng có chức năng ngăn chặn mã độc trên cửa hàng google play rất thấp đa số phần mềm diệt virus trên cửa hàng play của google không có tác dụng như quảng cáo đại diện av-comparatives cho biếtcụ thể av-comparatives đã thử nghiệm 250 phần mềm diệt virus phổ biến cho thiết bị android đang có mặt trên play store chúng sẽ đối đầu với 2000 file *apk nhiễm độc và 100 file *apk sạch thông qua samsung galaxy s9 chạy android 80kết quả chỉ 23 trong số sản phẩm thử nghiệm phát hiện 100% mẫu phần mềm độc hại hơn 2/3 không đạt tỷ lệ chặn 30% chưa tới 1/10 trong đó bảo vệ smartphone đúng nghĩa trước mã độc thậm chí chúng còn chặn nhầm cả những phần mềm không dính virustheo av-comparatives chỉ một số sản phẩm đến từ các hãng bảo mật danh tiếng như norton avira avg hay avast mới có tác dụng thực sự trong khi đó phần còn lại chủ yếu chiếm dụng bộ nhớ điện thoại hiển thị quảng cáo để kiếm tiền dụ dỗ người dùng tải ứng dụng khác hay thậm chí là phát tán mã độctừ kết quả này đại diện av-comparatives khuyến cáo người dùng nên sử dụng các phần mềm diệt virus từ thương hiệu uy tín đã khẳng định tên tuổi đồng thời hạn chế dùng sản phẩm lạ có điểm đánh giá thấpnhư phúc theo bgr
LG sẽ quay lại thị trường smartphone Việt Nam,bên lề sự kiện innofest 2019 ông moon jung soo giám đốc ngành hàng điện tử của lg cho biết họ sẽ đem smartphone trở lại thị trường việt nam thời gian tới nhưng khác với trước đó smartphone của lg sẽ được bán thông qua cửa hàng trực tuyến của hãng không được phân phối tại các cửa hàng bán lẻ và chỉ tập trung vào phân khúc cao cấp những model dự kiến được đưa về thời gian tới là g8 thinq và v50 thinq vừa ra mắt cuối tháng 2 tại ces 2019thị trường smartphone việt nam đang mất dần các thương hiệu tên tuổi mới đây điện thoại sony liên tục được giảm giá giới công nghệ cho rằng đây là chiêu xả hàng ngừng kinh doanh tại việt nam một năm qua htc cũng không còn ra sản phẩm mới và chỉ bán máy tồn độc quyền tại một vài hệ thống trong khi đó thị trường ngày càng nhiều thương hiệu điện thoại trung quốc còn ở phân khúc cao cấp thị phần chính thuộc về samsung và appletheo ông lê quang vũ tổng giám đốc hệ thống media mart việc lg quay lại mảng smartphone tại việt nam khó làm thay đổi cục diện thị trường và thị phần điện thoại hiện nay các sản phẩm mà họ đưa về có thể nhằm hỗ trợ cho các sản phẩm gia dụng thiết bị nhà thông minh thinq mà họ sẽ đẩy mạnh trong thời gian tới về tính năng và giá smartphone mới của lg khó cạnh tranh với sản phẩm của samsung apple và các thương hiệu trung quốc ở việt namđại diện lg cũng cho biết trong lần tái xuất này hãng không đặt kỳ vọng nhiều vào doanh số hay thị phần những mẫu smartphone mới của hãng nằm trong dải sản phẩm thinq ai là một phần trong hệ sinh thái nhà thông minh bao gồm nhiều thiết bị điện tử và gia dụnghiện tại smartphone của lg chỉ còn xuất hiện trên thị trường theo đường xách tay với các model cũ như g6 v30 hay v30 plus
Trò lừa bình luận 'Bisou' để kiểm tra tài khoản Facebook,facebook hiện bảo trì hãy bình luận bisou nếu hiện màu đỏ là tài khoản của bạn an toàn nhé nếu không bạn nên đổi mật khẩu vì có thể tài khoản đã bị hack thông điệp này cũng như các trạng thái tương tự đang lan truyền trên facebook nhất là sau khi mạng xã hội lớn nhất thế giới bị sập không chỉ trang cá nhân hay các hội nhóm bán hàng nội dung này còn được một số fanpage thuộc các doanh nghiệp lớn áp dụngrất nhiều người đã làm theo thay vì tìm hiểu vấn đề thậm chí khi không nhận thấy dòng chữ chuyển sang màu đỏ một số còn bày tỏ sự lo lắng cho rằng tài khoản của mình có thể đã bị hacker xâm nhậptuy nhiên đây thực chất là một trò chơi khăm tương tự việc kêu gọi bình luận bff màu xanh hay gratula màu đỏ diễn ra năm ngoái bisou là tiếng pháp có nghĩa là nụ hôn đó cũng là lý do vì sao khi nhấp vào từ này hiệu ứng hình trái tim sẽ hiển thịtrên thực tế khi đăng trạng thái hoặc gõ một số cụm từ như best wishes xo hoặc xoxo bisou gratula chúc mừng chữ sẽ chuyển sang màu sắc khác nhau đồng thời khi nhấn vào sẽ có hiệu ứng nhất định tính năng này được facebook bổ sung từ 2017anh thế lạng một người làm trong lĩnh vực marketing facebook tại tp hcm cho rằng tính năng trên đơn thuần để tăng trải nghiệm không hề có tác dụng trong việc kiểm tra bảo mật tài khoản như nội dung thông điệp đưa ra với trường hợp chữ không hiển thị có thể thuật toán facebook chưa cập nhật cùng lúc hoặc vấn đề liên quan đến trình duyệtông võ đỗ thắng giám đốc trung tâm an ninh mạng athena cho rằng những chiêu trò trên chủ yếu để câu like tăng tương tác thường được những người bán hàng online chạy quảng cáo facebook lợi dụng không ít người lợi dụng facebook gặp sự cố hay bê bối bảo mật để tung tin đồn không chính xác do đó người dùng cần kiểm tra kỹ càng thông tin trước khi bình luận vì hành động đó có thể bị lợi dụng ông thắng cảnh báobảo lâm
Nhà thông minh nền tảng ThinQ AI của LG,
Tai nghe không dây có thể gây ung thư,theo atlanta journal-constitution 250 nhà khoa học và chuyên gia đã cùng ký một bản kiến nghị gửi lên liên hợp quốc un và tổ chức y tế thế giới who nêu rõ nguy cơ bị ung thư từ các loại tai nghe không dây công nghệ bluetooth kết nối giữa tai nghe và thiết bị phát nhạc được cho là nguyên nhân dẫn đến tác hại không mong muốncụ thể công nghệ bluetooth hiện tại sử dụng sóng vô tuyến tần số điện từ emf để truyền dữ liệu việc sóng này liên tục truyền đến tai nghe có thể tác động đến hộp sọ và điều này được coi là nguy hiểmtheo cơ quan nghiên cứu ung thư quốc tế emf có thể gây ung thư cho con người bên cạnh đó mức độ tiếp xúc cao với loại sóng này còn gây ra các vấn đề về thần kinh và tổn thương dnadựa trên nghiên cứu đã công bố chúng tôi có những lo ngại nghiêm trọng về sự tiếp xúc phổ biến và ngày càng tăng đối với emf tạo ra bởi thiết bị điện và không dây trích nội dung bản kiến nghịemf trên những loại tai nghe như airpods ở ngưỡng cho phép của who nhưng vấn đề an toàn của nó khi sử dụng lâu dài vẫn là dấu chấm hỏitheo gartner đến 2022 thiết bị đeo tai sẽ là sản phẩm phổ biến với 15843 triệu chiếc xuất xưởngbản kiến nghị của các nhà khoa học lần đầu được công bố vào năm 2015 và trình lên who gần đây được chỉnh sửa và bổ sungbảo lâm
Ảnh chế sự cố Facebook sập trên toàn cầu,
Các chủ shop online ca thán vì Facebook gặp sự cố,từ 23h ngày 13/3 nhiều người dùng tại việt nam cho biết đã gặp tình trạng khó khi gửi tin nhắn messenger không thể chia sẻ ảnh hay bình luận trên facebook instagram công cụ downdetector ghi nhận hàng chục nghìn báo cáo từ nhiều khu vực trên thế giới về sự cố với các dịch vụ của mạng xã hội facebooktrước đó từ chiều qua một số chủ của hàng trong nước đã phàn nàn khi không thể gửi tin nhắn thông qua fanpage tôi vẫn nhận được nội dung khách hàng gửi tới nhưng gõ trả lời đều báo lỗi quản lý một phòng tập thể hình ở đường phùng khoang hà nội chia sẻthấy khách hàng hỏi mua đồ trên facebook mà không có cách nào trả lời cứ gửi đi là lại hiện chấm than màu đỏ gia tường chủ một cơ sở kinh doanh phụ kiện điện thoại ở tp hcm cho biết tôi đã thử cả bản web cũng như ứng dụng facebook trên di động thì đều bị lỗi cảbán đồ dành cho giới trẻ 80% khách hàng của anh tường đến từ facebook nên sự cố này khiến doanh thu trong ngày của shop giảm mạnh với dân bán hàng online facebook đâu có miễn phí mỗi ngày tôi chi tiền triệu để chạy quảng cáo lỗi thế không thể nào 'chốt' được đơn anh nóitrên các nhóm chia sẻ kinh nghiệm bán hàng trực tuyến nhiều thành viên cũng phàn nàn vì facebook tiền quảng cáo vẫn trừ đều mà từ chiều qua fanpage cửa hàng tôi chỉ có 1-2 khách nhắn tin trong khi thường ngày phải cử riêng một nhân viên trả lời anh xuân đoàn kêu ca cứ thế này tôi phải tính thêm hướng kinh doanh để bớt lệ thuộc vào facebooktrong phần thiết lập quảng cáo facebook thừa nhận dịch vụ quảng cáo có thể không khả dụng mạng xã hội này cho biết: dù quảng cáo hiện tại tiếp tục được phân phối các chiến dịch có thể bị giảm phạm vi tiếp cận do một số người gặp khó khi truy cập ứng dụng của chúng tôifacebook lỗi tương tác giảm mạnh nhưng các chiến dịch quảng cáo đã chạy vẫn bị trừ tiền bình thường phan hội một chuyên gia trong lĩnh quảng cáo nói các công ty thường hoàn tiền đền bù khi dịch vụ của mình gặp sự cố nhưng tôi chưa khi nào thấy chính sách tương tự từ facebook dù đã chi cả tỷ đồng quảng cáo trên mạng xã hội nàyfacebook không ít lần trục trặc nhưng lỗi lần này được đánh giá là kéo dài nhất và trên diện rộng nhất người dùng phổ thông đã than phiền gặp khó khi truy cập mạng xã hội này trong khoảng 8 giờ qua trong khi việc gửi tin nhắn thông qua fanpage thiết lập quảng cáo trên facebook vẫn bị chập chờn sau gần 20 giờtrong năm 2018 facebook cũng nhiều lần gặp gần nhất là vào giữa tháng 11 khi nhiều người không thể vào tài khoản của mình website hiển thị thông báo sorry something went wrong trên cả messenger whatsapp và instagram tháng 9/2018 hàng chục triệu tài khoản facebook tự thoát và phải đăng nhập lại đại diện facebook sau đó cho biết một cuộc tấn công tinh vi vào mạng xã hội đã diễn ra và phải đăng xuất gần 90 triệu tài khoản cuối tháng 2 năm ngoái facebook và cả instagram đều không thể truy cập và tình trạng này kéo dài tới 30 phút đầu tháng 3 giao diện web cũng gặp lỗi không hiển thị danh sách bạn bè
Xiaomi ra hai bộ phát Wi-Fi giá rẻ Mi Router 4A,xiaomi hôm qua ra mắt cùng lúc hai bộ phát wi-fi mới là mi router 4a và mi router 4a gigabit - những model biến thể từ mi router 4 hai thiết bị có ngoại hình giống nhau với lớp vỏ bằng nhựa trắng nhám nhẹ thiết kế bo tròn hơn thế hệ mi router 3 nhưng vẫn có 4 ăng-ten đi kèmcả hai đều hỗ trợ hai dải tần là 24 ghz và 5 ghz không bị nhiễu lẫn nhau dải tần 24 ghz cho độ phủ lớn hơn khả năng xuyên tường tốt hơn trong khi dải tần 5 ghz sử dụng công nghệ 80211ac ít nhiễu và hỗ trợ tốc độ cao nhà sản xuất cài đặt sẵn bản firmware miwrom dựa trên tùy chỉnh sâu của nền tảng openwrtmi router 4a dùng chip mediatek mt7628da ram 64 mb và 16 mb rom trên bo mạch phía sau có hai cổng lan 100 m và một cổng wan 100 m sản phẩm phù hợp với người dùng có kết nối băng rộng dưới 100 mb hỗ trợ tối đa 64 thiết bịphiên bản mi router 4a gigabit cao cấp hơn với chip xử lý 4 lõi 880 mhz ram 128 mb khác biệt lớn nhất đến từ hai cổng gigabit lan và một cổng gigabit wan phía sau sản phẩm có thể kết nối ổn định với 128 thiết bịmi router 4a có giá 119 tệ khoảng 420000 đồng và mi router 4a gigabit là 169 tệ khoảng 590000 đồng
Ý tưởng iPhone 11 chạy iOS 13 với chế độ tối,
Galaxy M20 'đối đầu' Xiaomi Mi A2,galaxy m20 bán ra từ giữa tháng 2 làm sôi động thêm phân khúc smartphone tầm 5 triệu đồng vốn đã chật chội tại thị trường việt nam trong khi đó xiaomi mi a2 đã ra mắt được nửa năm nhưng vẫn được người dùng chú ý nhờ cấu hình tốt giá mới được điều chỉnh từ 7 triệu đồng còn 55 triệu đồng cạnh tranh trực tiếp với sản phẩm của samsungcả hai máy đều được làm nguyên khối trong đó mi a2 có mặt sau bằng kim loại còn galaxy m20 là nhựa nhưng hoàn thiện giống kính điện thoại của xiaomi đem đến cảm giác cầm chắc chắn nhẹ hơn một chút nhưng cấn tay hơn ở phần viền so với sản phẩm của samsungtuy nhiên điện thoại của samsung có ống kính góc rộng ultrawide cho phép lấy được nhiều chi tiết hơn ở cùng khoảng cách chụp phát huy khi chụp phong cảnh hay chụp ảnh nhóm hai smartphone đều hỗ trợ chụp hình xóa phông bokeh trông khá thật trong điều kiện đủ sángcổng usb-c có trên cả hai smartphone nhưng chỉ điện thoại của samsung có giắc tai nghe 35 mm bên trong galaxy m20 là pin dung lượng 5000 mah gấp hơn 15 lần so với pin 3000 mah trên mi a2galaxy m20 nhỉnh hơn về thiết kế và pin còn mi a2 lại mạnh về cấu hình điện thoại của xiaomi dùng chip snapdragon 660 ram 4 gb bộ nhớ trong 64 gb không hỗ trợ khe cắm thẻ nhớ trong khi đó mẫu máy samsung có bộ xử lý exynos 7904 ram 3 gb bộ nhớ 32 gb nhưng cho phép cắm thẻ microsdchấm điểm hiệu năng với benchmark 4 smartphone của xiaomi cho kết quả cao hơn khoảng 15% so với máy samsung trải nghiệm thực tế hai thiết bị đều chạy mượt với các tác vụ thông thường khi vào game nặng mi a2 tải nhanh hơn 1-2 giây so với galaxy m20 bộ đôi smartphone này được cài hệ điều hành android 81
