Galaxy S10 là smartphone có màn hình tốt nhất thị trường,theo tổ chức chuyên đánh giá chất lượng màn hình nổi tiếng display mate galaxy s10 là smartphone có điểm đánh giá màn hình tốt chưa từng có cao nhất trong nhóm sản phẩm có chất lượng màn hình a+ hiện naycác chuyên gia đánh giá của display mate cho rằng màn hình dynamic amoled của samsung có độ chính xác màu cực cao có thể coi là hoàn hảo tương tự s10 cũng có khả năng thể hiện độ tương phản chính xác ấn tượng độ sáng của màn hình lập kỷ lục khi đạt tới 1215 nit hơn 17% so với s9 năm ngoáibên cạnh đó màn hình trên thế hệ smartphone mới nhất của samsung đã được cải thiện nhiều ở góc nhìn khả năng điều tiết ánh sáng xanh tiết kiệm điện năng và có khả năng thể hiện nội dung hdr+ tốt hơn việc hỗ trợ hdr10+ trên mẫu smartphone này cũng được đánh giá rất cao khi nó đem lại màu sắc sâu và độ tương phản cao hơn so với hdr10 trên sản phẩm thông thườngvới các kết quả đánh giá trên galaxy s10 là smartphone có màn hình tốt nhất hiện nay không chỉ nhiều cải thiện so những model đời trước của samsung như galaxy s9 hay note9 mà còn qua mặt nhiều đối thủ cao cấp như pixel 3 xl hay iphone xs max về khả năng hiển thịgalaxy s10 là dòng smartphone đánh dấu thay đổi trong thiết kế màn hình khi samsung sử dụng màn hình vô cực infinity-o với camera được đặt trong màn hình bên cạnh đó cảm biến vân tay cũng sử dụng công nghệ siêu âm ẩn trong màn hình phía trước
HTC có thể nhượng quyền thương hiệu cho nhà sản xuất Ấn Độ,theo indiatimes htc đang làm việc với ba nhà sản xuất smartphone hàng đầu ấn độ là micromax lava và karbonn để bàn về thỏa thuận cấp phép sử dụng tên thương hiệu nếu ký kết các công ty được chọn sẽ tạo ra thiết bị dưới tên gọi htc còn hãng điện thoại đài loan thu tiền bản quyền trên mỗi sản phẩm bán racác điều khoản cụ thể và phân khúc giá bán chưa được tiết lộ chưa rõ ngoài ấn độ htc còn nhượng quyền sử dụng thương hiệu cho những công ty thuộc quốc gia khác hay khôngtrước đó blackberry cũng nhượng quyền sử dụng thương hiệu cho tcl của trung quốc và đã gặt hái một số thành công nhất định hiện smartphone blackberry có dấu hiệu hồi sinh mạnh mẽ với doanh số bán hàng tăng theo từng nămhtc vật lộn với tình hình kinh doanh không mấy khả quan thời gian qua khi kết quả tài chính mỗi quý giảm dần đều thậm chí có nhận định cho rằng hãng đang chờ chết theo phonearena nếu tham gia thị trường ấn độ htc buộc phải tạo ra các sản phẩm giá rẻ và tầm trung bởi đây là phân khúc được người dùng ưa chuộng tuy vậy công ty sẽ phải cạnh tranh gay gắt với xiaomi samsung hay oppobảo lâm
Chuẩn USB4 trình làng với tốc độ truyền dữ liệu gấp đôi chuẩn cũ,diễn đàn triển khai usb usb-if hôm nay công bố chuẩn usb4 phiên bản thay thế cho chuẩn usb 32 trước đó tuy nhiên các thông số kỹ thuật mới chỉ là dạng dự thảo trước khi chính thức có mặt trên các thiết bị phần cứng vào cuối năm nay cách thức viết tiêu chuẩn mới cũng được tổ chức này viết liền usb4 thay vì usb 40 giống các tiêu chuẩn trước đó usb 30 usb 32usb4 sẽ có tốc độ truyền tải dữ liệu tối đa lên tới 40 gb/giây tương đương 5 gb/giây gấp đôi so với chuẩn usb 32 trước đó đây cũng chính là tốc độ của chuẩn kết nối thunderbolt 3 ra mắt vào năm 2015 nhưng đã được intel hứa hẹn cung cấp rộng rãi đặc tính kỹ thuật vào năm 2017 với sự xuất hiện của usb4 intel đã giữ lời khi chia sẻ với chuẩn kết nối phổ biến nhất thế giớingoài tốc độ truyền tải dữ liệu lớn chuẩn usb4 cũng cung cấp điện năng lên tới 100w đi kèm với thông lượng dữ liệu này kết nối mới đủ sử dụng cho card đồ họa gắn ngoài và cấp nguồn cho hai màn hình 4k hoặc một màn hình 5k tuy nhiên người dùng cũng cần nâng cấp các loại cáp nối hiện tại để đáp ứng được lưu lượng 40 gb/giâychuẩn usb4 mới sẽ sử dụng chính trên cổng kết nối vật lý usb type-c apple gọi là usb-c đang dần phổ biến hiện nay nhưng thay vì có màu để nhận biết chuẩn kết nối như màu xanh dương để chỉ usb 30 đến 32 thì usb4 vẫn chưa có màu sắc đại diệncó đặc tả kỹ thuật khá giống nhau tiêu chuẩn usb4 và thunderbolt 3 vẫn sẽ cùng tồn tại trong khi usb4 là chuẩn mở có thể thay đổi một số chi tiết kỹ thuật tùy vào nhà sản xuất thì thunderbolt 3 đòi hòi chứng nhận từ inteltheo usb-if bộ thông số kỹ thuật đầy đủ của usb4 dự kiến sẽ có vào cuối năm nay sau thời điểm đó tổ chức này hy vọng các thiết bị sử dụng chuẩn kết nối sẽ phổ biến khoảng hơn một năm sau đó
iPhone 2019 có thể trang bị tính năng dùng dưới nước,theo tài khoản max weinbach của xda developer người có nhiều dự đoán đúng về các thiết bị di động chưa ra mắt underwater mode đã được cấp bằng sáng chế và có thể tích hợp ngay trên iphone trong năm nay chế độ này giúp smartphone apple hoạt động trơn tru cả khi ở dưới bể bơi hoặc trời mưa tomax weinbach cũng cho rằng apple sẽ nâng cấp công nghệ phản hồi xúc giác haptic engine công ty mỹ chia màn hình iphone thành 9 khu vực khi nhấn và giữ vùng cụ thể nào chỉ có không gian tại đó rung lên thay vì rung toàn bộ máy như hiện nayngoài ra iphone 2019 ra mắt chạy ios 13 với giao diện tăng/giảm âm lượng kiểu mới hay chế độ tối dark mode tuy nhiên máy chỉ hỗ trợ 4g thay vì 5g như sản phẩm của samsung huawei tcl oppo motorolatrước đó chuyên gia tin đồn ming-chi kuo dự đoán apple không tham gia thị trường smartphone 5g cho đến 2020 về iphone 2019 ông này cho rằng máy có ba kích thước gồm iphone xi 58 inch iphone xi max 64 inch và iphone xr 2019 61 inch hai thiết bị đầu dùng tấm nền oled trong khi bản xr giá rẻ vẫn sử dụng lcdriêng iphone xi max apple có thể trang bị camera sau ba ống kính với công nghệ time of flight tof cho phép dùng hồng ngoại để nhận dạng đối tượng chính xác đo độ sâu bức ảnh cũng như hỗ trợ thực tế tăng cường ar cổng usb type c sẽ vẫn chưa xuất hiện trên iphone đời mớibảo lâm theo phonearena
"Qualcomm đòi Apple trả 1,41 USD trên mỗi iPhone bán ra",tuần này qualcomm và apple đối đầu tại tòa án quận san diego mỹ reuters cho biết công ty sản xuất chip cáo buộc apple vi phạm một bằng sáng chế liên quan tới việc khởi động điện thoại nhanh hơn và một bằng khác về việc kéo dài thời lượng pin cho một số tác vụ nhất địnhqualcomm mong muốn được bồi thường 141 usd cho mỗi chiếc iphone bán ra từ giữa năm 2017 đến mùa thu 2018 hãng khẳng định các phiên bản iphone dùng chip mạng của intel chiếm một nửa số iphone được tiêu thụ trong khoảng thời gian trên đã vi phạm bản quyền của hãngtiếp đó ngày 26/3 ủy ban thương mại quốc tế itc sẽ quyết định có ban hành một lệnh cấm nhập khẩu và bán một số mẫu iphone nhất định một thẩm phán của itc cho rằng apple vi phạm một bằng sáng chế của qualcomm nhưng không cấm iphone vì hành động này sẽ ảnh hưởng đến thị trường chip phán quyết đầy đủ sẽ được đưa ra trong vòng ba tuần tớisang tháng 4/2019 apple và qualcomm sẽ lại tranh luận ở tòa án bang liên quan tới khoản tiền một tỷ usd mà apple cho là họ phải trả một cách không công bằng cho qualcommcụ thể hai hãng được cho là đã có những thỏa thuận riêng trong đó có một điều khoản nếu apple sử dụng độc quyền chip modem của qualcomm thì sẽ được giảm giá chi phí liên quan tới giấy phép sở hữu trí tuệ thế nhưng táo khuyết lại cho rằng qualcomm đã tính phí bản quyền một cách vô lý cho công nghệ không có gì liên quan tới họví dụ nếu một chiếc iphone bị hỏng và cần chuyển tới nhà máy foxconn để sửa chữa qualcomm đòi 5% trong số tiền mà foxconn thu của apple để sửa thiết bị apple cho rằng đây là đòi hỏi vô lý vì vấn đề chẳng liên quan gì tới linh kiện hay công nghệ của hãng đáp lại qualcomm khẳng định cáo buộc của apple không có cơ sở và còn che giấu nhiều thông tin khác cố ý nói sai về thỏa thuận giữa hai bên hãng tuyên bố sẽ cung cấp các bằng chứng liên quan tại tòa ánmâu thuẫn giữa hai hãng bắt đầu diễn ra từ tháng 1/2017 khi qualcomm bị ủy ban thương mại mỹ ftc cáo buộc vi phạm nghiêm trọng luật cạnh tranh công bằng khi mua chuộc các công ty điện thoại đặc biệt là apple dùng độc quyền chip của mình chỉ sau vài ngày đến lượt apple kiện hãng sản xuất chip và đòi bồi thường một tỷ usd qualcomm cũng tố apple vi phạm bản quyền sáng chế và yêu cầu cấm bán một số mẫu iphone tại mỹ trung quốc và đức ngày 26/10/2018 qualcomm cho biết apple đang nợ 7 tỷ usd tiền bản quyền bằng sáng chế chip di động được sử dụng trên iphone
Xe bus thông minh chống ngập nước,
Khám phá hoạt động nhà thông minh qua một chiếc vali,
Samsung Galaxy S10e - lựa chọn cho người thích điện thoại nhỏ gọn,
TV Sony có còn tốt như xưa không?,trước đây đi mua đồ điện tử ba tôi thường dặn mua mấy đồ của nhật bản cho bền giờ tôi muốn mua một tv cho ba má dưới quê xem tính chọn sony mà vào xem bình luận của bài chọn tv sony samsung hay loại nào khác bền hơn? thấy hoang mang quátôi cũng không nặng nề với thương hiệu hàn lg hay samsung nhưng vì ba thích hàng nhật nên tính mua sony nhưng mua rồi mà hỏng thì cũng phí tiền với bảo hành các thứ cũng lằng nhằng vì ba má dưới quê khó mang đi sửa chữatôi có tầm 10 triệu đồng và tính mua tv tầm 40 inch trở lên mong các bạn cho ý kiếnsầm dươngduongst0908
"Galaxy Watch, đồng hồ thông minh giá 7 triệu đồng cho iOS, Android",
"LG gram 2018 - laptop 15 inch siêu nhẹ, pin một ngày",
Galaxy Note9 - smartphone cho người thích khám phá,
R15 - smartphone màn hình tai thỏ đầu tiên của Oppo,r15 có thiết kế khung kim loại và hai mặt kính theo xu thế chung hiện nay khác với đàn em f7 r15 có khung bằng thép giống như iphone x và mặt lưng kính chứ không phải nhựa cho cảm giác cầm đầm và chắc tay hơn các model cùng phân khúc mặt lưng kính đổi màu theo góc nhìn đẹp mắt tương tự mẫu oppo f9 model này được trang bị camera kép oppo vẫn bố trí cụm camera nằm ngang thay vì dọc theo xu thế chung hiện nay một điểm trừ trong thiết kế là phần viền nhựa bao quanh màn hình gây cấn tay khi vuốt về hai bên các cổng kết nối như jack cắm tai nghe cổng sạc đều nằm ở dưới đế máy oppo vẫn sử dụng cổng microusb thay vì usb c trên r15
Kích hoạt chế độ nền tối trên Facebook Messenger,theo gadgethacks facebook đang thử nghiệm chế độ nền tối trên ứng dụng messenger tại một số quốc gia nhất định việt nam không nằm trong danh sách này tuy nhiên người dùng có thể dùng thử thông qua một thủ thuật nhỏnếu khi gửi biểu tượng mặt trăng nhưng không xuất hiện dòng thông báo trên bạn cần cập nhật facebook messenger lên phiên bản mới nhất bên cạnh đó do đang trong quá trình thử nghiệm tính năng có thể gặp trục trặc khi hoạt động khiến trải nghiệm không như ýtheo phonearena dark mode hay chế độ ban đêm được xây dựng dành cho những người thường xuyên đọc sách ban đêm cũng như những ai không thích ánh sáng trắng của màn hình điện thoại nó biến toàn bộ giao diện phần mềm sang tông màu tối giúp bảo vệ mắt tốt hơn cũng như tăng khả năng tiết kiệm pin hiện macos 1014 mojave dành cho máy tính của apple hay giao diện one ui cho smartphone của samsung đã có chế độ nàybảo lâm
Momo trở thành nỗi sợ của trẻ em trên YouTube,momo hay thử thách momo là chủ đề được quan tâm thời gian gần đây cha mẹ lo lắng liệu nó có ảnh hưởng đến con cái các đơn vị liên quan đến giáo dục hay nhà quản lý nội dung trên internet đưa ra những cảnh báo về những mối nguy hiểm khi cho trẻ tiếp cận với internet mà không có sự giám sát liên tục tuy nhiên momo - một nhân vật kinh dị đang bị đánh đồng với thử thách momo - trào lưu tự gây hại thậm chí hướng dẫn người tham gia tự tửtheo telegraph nhân vật momo xuất phát từ tác phẩm điêu khắc được tạo bởi nghệ sỹ keisuke aisawa tại link factory - một công ty của nhật bản chuyên về đạo cụ phim kinh dị hình ảnh của nhân vật này với tóc dài mắt lồi thân mình trông giống gà có thể gây ghê rợn cho nhiều người đặc biệt là trẻ em nhân vật momo đã được đăng trên mạng và chia sẻ hàng nghìn lần trên diễn đàn redditđây là trò bịp xuất phát từ ứng dụng nhắn tin whatsapp sau đó lan truyền sang các phương tiện truyền thông khác trong đó người chơi sẽ phải thực hiện các thử thách theo nhiều mức độ có những nhiệm vụ mà khi người chơi hoàn thành sẽ làm bị thương chính mình hay người xung quanh thậm chí dẫn tới bạo lực hoặc tự sáttrước thử thách momo những trò bịp gây hại khác cũng đã lan truyền như thử thách cá voi xanh - yêu cầu người tham gia rạch tay hay nhảy từ lầu cao thử thách tide - ăn viên giặt xả quần áo một số thử thách khác lại nhằm lan truyền thông điệp tích cực chẳng hạn thử thách nước đá - ice bucket challenge để nâng cao nhận thức về hội chứng xơ cứng teo cơ một bênnăm ngoái truyền thông nam mỹ bắt đầu liên kết giữa hình ảnh về thử thách với nguyên nhân nhiều cái chết của trẻ em địa phương tuy nhiên báo cáo không có xác minh sau đó một số tài khoản youtube trong đó có reignbot với nửa triệu người theo dõi đăng video bàn về thử thách và một số cơ quan chức năng đã đưa ra cảnh báo về những mối nguy hiểm có thể gây ra với trẻ emtheo washington post câu chuyện về thử thách momo trở nên lan truyền mạnh mẽ vào cuối tháng 2/2019 khi một bà mẹ tại anh đăng trên facebook nói rằng con bà đã tìm kiếm thử thách momo trên mạng thông tin sau đó được một số kênh truyền thông đưa lại với các tựa đề giật gân tập trung vào việc thử thách khuyến khích người chơi tự sát tin tức tiếp tục lan truyền tại anh nhất là với các bậc phụ huynh rồi sang mỹ và toàn thế giớidaily telegraph cho biết đã tìm thấy nhiều video thử thách momo trên youtube và instagram bao gồm những video do người dùng thực hiện và những nội dung được lồng ghép trong những video không chính thức có nhân vật peppa pig hai nền tảng này đã xóa các video đó sau khi được người dùng báo cáo nội dung không phù hợptrong khi đó youtube phủ nhận và nói các quy định của dịch vụ này cấm nội dung khuyến kích các hành động nguy hiểm có nguy cơ gây hại hoặc gây tử vong đại diện google cho biết: gần đây chúng tôi chưa từng nhận được bất kỳ bằng chứng nào về những video thể hiện hoặc chia sẻ momo challenge trên youtube những nội dung như thế này vi phạm chính sách của chúng tôi và sẽ bị xóa khỏi youtube ngay lập tứcthực tế thông tin được lan truyền gần đây tập trung hướng vào nhân vật momo với ngoại hình kỳ dị có thể gây hoảng sợ cho trẻ em nhân vật momo được chèn vào một đoạn bất ngờ trong các video được đăng trên youtube kèm theo những lời lẽ mang tính chất hù dọa nhưng rất tiêu cực chẳng hạn: bạn sẽ chết trẻ em thấy hình ảnh này có thể khóc bỏ ăn nhưng cảnh sát anh thông báo chưa có bất kỳ trường hợp trẻ em nào tự làm hại mình do nhân vật momonhân vật momo có thể khiến trẻ em hoảng sợ những lời hù dọa có thể ảnh hưởng không tốt tới tâm lý của trẻ nhưng thử thách momo hoặc các nội dung tương tự mới thật sự nguy hiểm và chúng tồn tại trên youtube đó là những video hướng dẫn trẻ tự làm hại bản thân bằng cách rạch tay video hoạt hình sử dụng cảnh bạo lực nhìn thoáng qua nó giống như một bộ phim cho trẻ em nhưng nội dung truyền tải lại mang ý nghĩa tiêu cực hướng dẫn trẻ làm hại chính mìnhđầu 2017 youtube tràn lan những video nội dung người lớn đội lốt phim trẻ em công chúa elsa mặc bộ quần áo hở hang nhân vật spiderman joker superman hay hulk thực hiện cảnh ôm hôn phản cảm với bạn diễn những nội dung rẻ tiền các bài hát vô nghĩa cũng xuất hiện nhiều trên đây youtube còn bị phản ứng khi để những bình luận phản cảm các lời lẽ mang tính chất kích dục ấu dâmnội dung tiêu cực không phù hợp với độ tuổi của người xem là vấn đề tồn tại của youtube nền tảng này cần phải có những bộ lọc tốt hơn nữa nhằm ngăn chặn nguy cơ có thể xảy ra nhất là với trẻ em trong khi đó giải pháp dễ dàng nhất đối với các bậc phụ huynh có trẻ nhỏ có lẽ là loại bỏ youtube khỏi mọi thứ từ điện thoại tv máy chơi game ipadứng dụng youtube kids được thiết kế dành riêng cho trẻ em sẽ giúp lọc các kênh có nội dung phù hợp giới hạn thời gian xem cha mẹ nên giám sát khi cho con sử dụng điện thoại truy cập youtube để biết nội dung trên đó là gì nếu dùng chính tài khoản youtube trên thiết bị mà mình đang sử dụng trẻ em hoàn toàn có thể bắt gặp những nội dung chỉ dành riêng cho người lớn bởi lúc này tài khoản đăng nhập lại là của chính cha mẹ
