Canon EOS RP - máy ảnh không gương lật full-frame giá rẻ,eos rp là mẫu máy không gương lật full-frame thứ hai của canon trong khi eos r được phát triển từ mẫu dslr 5d mark iv đàn em eos rp được phát triển từ dslr 6d mark ii nên có mức giá tốt so với các sản phẩm có cảm biến full-frame hiện có trên thị trườngeor rp được trang bị cảm biến cmos độ phân giải 262 megapixel chip xử lý digic 8 hệ thống lấy nét dual pixel af với 4799 điểm khả dụng bao phủ 88% khung hình khả năng lấy nét ở điều kiện ánh sáng tối tới -5evmáy ảnh mới hỗ trợ iso từ 100 đến 40000 cho chụp ảnh và 25600 cho quay phim model này chụp tối đa 5 khung hình mỗi giây canon tích hợp kính ngắm điện tử với độ phân giải 236 triệu điểm ảnh màn hình lcd phía sau kích thước 3 inch hỗ trợ cảm ứng độ phân giải 104 triệu điểm ảnhkhác với eos r eos rp không được trang bị khả năng chống chọi thời tiết như mưa bụi và có kích thước nhỏ hơn rp cũng không có màn hình lcd hiển thị các thông số phía trên cũng như cắt giảm touchpad ở cạnh khung ngắm máy vẫn có các kết nối như cổng hdmi usb-c giắc cắm tai nghe micro kết nối không dây như wi-fi bluetootheos rp sẽ được bán ra với giá 1300 usd cho thân máy hoặc 2400 usd cho thân máy kèm ống kính ngàm rf 24-105 f4 l us usm
Rapper chi 400.000 USD mua ốp lưng siêu sang cho iPhone,theo complex rapper nổi tiếng người canada aubrey drake graham đã mua  ốp lưng từ nhà cung cấp trang sức cao cấp jason of beverly hills ngay khi iphone mới ra mắt drake đã tìm đến tôi ngỏ ý muốn tạo cái gì đó hoành tráng để thêm vào bộ sưu tập siêu sang của anh ấy jason arasheben giám đốc điều hành của jason cho biếtbộ case được làm từ 18 carat vàng trắng 80 carat kim cương trắng và xanh mặt sau đính kèm hình một con cú lớn cũng làm từ vàng trắngdrake sau đó chia sẻ video về phụ kiện mới lên instagram và nhận được hàng nghìn lượt thích và bình luận tuy nhiên một số fan của anh bình luận tỏ ý lo ngại nếu chẳng may thiết bị bị rơi trong khi số khác ngạc nhiên khi chi 400000 usd để bảo vệ cho một điện thoại giá hơn 1000 usdtrước đó luxury brikk liên doanh mỹ - trung đã bán một mẫu ốp lưng cho iphone 7 với giá từ 5000 usd đến 13 triệu usd hay bộ ốp cho iphone 8 plus của grey singapore cũng lên tới 1345 usdbảo lâm
FaceTime lại bị than phiền sau khi cập nhật lỗi nghe lén,theo macrumors nhiều tài khoản twitter cho biết không thể thêm thành viên khi trò chuyện facetime giữa hai người với nhau nếu muốn gọi nhóm người gọi buộc phải bắt đầu với hai người khác trở lên vấn đề xảy ra trên iphone ipad đã cập nhật ios 1214 mới nhấtở các phiên bản cũ người dùng vẫn có thể thêm thành viên bất cứ lúc nào mình muốn nhiều người chia sẻ trên mạng xã hội họ cảm thấy khó chịu vì buộc phải tắt facetime và thực hiện lại từ đầu nếu gọi nhóm thậm chí một số tin lỗi bảo mật trước đó vẫn chưa được sửa chữa khi thấy tính năng thêm thành viên không hoạt độngtrước phản ánh của người dùng tài khoản hỗ trợ apple support trên twitter chỉ hướng dẫn thực hiện cuộc gọi với ít nhất hai người trở lên nếu muốn dùng group facetimecuối tháng 1 nhiều người than phiền trên reddit và trang hỗ trợ apple về lỗi facetime khiến người gọi nghe âm thanh ở đầu bên kia dù phía nghe chưa nhấc máy lỗ hổng ảnh hưởng tới iphone ipad hay máy tính mac apple sau đó tạm khóa tính năng này và khắc phục trong bản cập nhật ios 1214 tuy vậy phiên bản mới lại dính hàng loạt lỗi nghiêm trọng khác như mất wi-fi 4g hay thậm chí là không nhận simbảo lâm
Ấn Độ có thể sắp kiểm duyệt Internet như Trung Quốc,theo nytimes chính phủ ấn độ đề xuất bộ quy tắc yêu cầu các công ty internet như facebook google twitter tiktok có thể phải xóa bài viết hay video mà họ cho là phỉ báng xâm phạm quyền riêng tư thù hận hoặc lừa đảo những nhà cung cấp dịch vụ này cũng sẽ phải xây dựng công cụ lọc tự động nhằm ngăn chặn người dùng tiếp cận nội dung được cho là không phù hợpdự thảo có thể được chính phủ của thủ tướng narendra modi áp dụng bất cứ lúc nào sau khi giai đoạn đóng góp ý kiến công khai kết thúc chính quyền ấn độ được cho là sẽ đẩy nhanh việc áp dụng luật mới trước khi bầu cử toàn quốc diễn ra trong những tháng tớimột số nhóm ủng hộ tự do nhân quyền và các nhà phê bình cho rằng những thay đổi này sẽ vi phạm hiến pháp đi ngược lại với quyền tự do ngôn luận và riêng tư của người dân ấn độ trước đó đã có nhiều động thái ưu tiên doanh nghiệp nội địa tương tự trung quốcnăm ngoái nhiều nước thuộc liên minh châu âu đã ban hành bộ quy tắc để bảo vệ dữ liệu trực tuyến của mọi người một cách cứng rắn đồng thời buộc phía cung cấp dịch vụ phải thay đổi một số điều khoản để phù hợp tình hình thực tế trung quốc từ lâu đã sử dụng một hệ thống bộ lọc gọi là great firewall để chặn nội dung nhạy cảm cũng như dịch vụ bất hợp pháp từ bên ngoài theo nytimes hơn 50 nước đã đưa ra luật mới nhằm kiểm soát người dân của họ dùng internetlâm anh
Công nghệ zoom 10X cho smartphone sắp ra mắt tại MWC,theo phonearena oppo sẽ giới thiệu công nghệ zoom 10x tại một sự kiện trước thềm triển lãm mwc 2019 diễn ra tại barcelona tây ban nha tính năng này có thể mở ra hướng đi mới trong việc nâng cấp chất lượng chụp ảnh cho smartphone mở rộng tiềm năng của điện thoại di độnggiải pháp của oppo sẽ bao gồm ống kính góc siêu rộng ống kính góc siêu rõ và ống kính tele được sắp xếp theo cấu trúc kính tiềm vọng thiết kế này giúp các linh kiện phù hợp với thiết kế mỏng gọn của điện thoại thông minh nhưng vẫn đảm bảo khả năng zoom xangoài ra hệ thống chống rung cũng được nhà sản xuất trung quốc tích hợp cho cả ba ống kính nhằm tăng độ ổn định sắc nét cho ảnh chụp đặc biệt khi zoom theo oppo công ty đã thử nghiệm thả rơi 28000 lần để đảm bảo công nghệ này đạt độ bền khi sử dụng và sản phẩm thương mại có thể ra trong nửa đầu 2019camera đa ống kính với khả năng zoom quang học trở thành xu hướng của các smartphone hiện nay tuy nhiên các thiết bị hiện nay chủ yếu dừng lại ở zoom quang học 2x iphone 7 plus đến iphone xs xs max galaxy a9 hay zoom quang 3x huawei p20 pro mate 20 pro
Công nghệ màn hình dẫn đầu làng smartphone của dòng Galaxy S,
Smartphone có thể uốn thành smartwatch,tcl là công ty nổi tiếng về tv giá thấp đồng thời sở hữu một số thương hiệu điện thoại như blackberry mobile và alcatel theo cnet họ đang nghiên cứu và phát triển ít nhất năm thiết bị sử dụng màn hình linh hoạt gồm hai máy tính bảng hai điện thoại thông minh và một điện thoại với màn hình có thể uốn cong thành smartwatchmột mẫu máy tính bảng có màn hình gập vào trong giống vỏ sò trong khi một mẫu khác có màn hình ở mặt ngoài tương tự royole flexpai trong khi đó điện thoại thông minh cũng có hai biến thể với màn hình gập vào bên trong và hướng ra ngoài tuy nhiên chúng uốn theo đường ngang giống chiếc điện thoại nắp gập truyền thốngchiếc điện thoại cuối cùng có thiết kế cao và dáng gầy có thể cong thành một chiếc vòng quanh cổ tayhiện chưa rõ khi nào những thiết bị này có thể xuất hiện thị trường nhưng cho thấy mối quan tâm ngày càng tăng của các công ty công nghệ đối với loại thiết bị có thể gập lại màn hìnhtháng trước một giám đốc điều hành tcl nói công ty dự kiến phát hành thiết bị có thể gập lại đầu tiên vào năm 2020 không chỉ là điện thoại thông minh stefan streit tổng giám đốc tiếp thị toàn cầu của tcl hé lộ trong cuộc phỏng vấn tại sự kiện ces 2019 đồng thời nhận định các sản phẩm tiêu dùng khác như thiết bị đeo thiết bị gia dụng và tv có thể được hưởng lợi từ công nghệ màn hình có thể gập
Sony đang 'hụt hơi' trước các đối thủ,sony là thương hiệu không xa lạ trên thị trường di động trong những năm 2000 không ít mẫu điện thoại nghe nhạc hay chụp ảnh đẹp được đón nhận dưới liên doanh sony ericsson năm 2007 thị phần điện thoại sony ericsson chiếm khoảng 9% trên toàn cầuđến 2010 liên doanh này lần đầu bước chân vào thế giới android với một số model đáng chú ý như xperia x10 và xperia arc một năm sau sony quyết định mua lại cổ phần của ericsson và đổi tên bộ phân di động là sony mobilesau khi đạt được 5% thị phần smartphone toàn cầu năm 2013 sony mobile đặt mục tiêu trở thành nhà sản xuất điện thoại thông minh lớn thứ ba thế giới thậm chí họ còn muốn trở thành apple trong giới android bằng những sản phẩm cao cấpkhác với ios chỉ dành riêng cho iphone thế giới android rộng lớn hơn nhiều người dùng có rất nhiều lựa chọn từ samsung htc để có trải nghiệm tương tự nhưng sony có vẻ không nhận ra điều này đưa ra giá bán cao hơn mặt bằng chung để xây dựng hình ảnh cao cấp trong khi không thực sự có tính năng đột phá khiến hãng bắt đầu trượt dài từ 2014 lượng máy bán ra sụt giảm chiến lược tiếp thị lại tỏ ra không hiệu quả và hãng cũng không giảm giá để thu hút khách hàngmột trong những sai lầm của sony tại thị trường mỹ là hời hợt trong việc liên kết cùng nhà mạng nguyên nhân được cho là do sony không muốn thực hiện các điều chỉnh cho điện thoại mà nhà mạng yêu cầu cũng như không đạt thỏa thuận chia doanh thu do đó doanh số bán hàng giảm đáng kể và việc quảng bá thương hiệu với khách hàng tiềm năng bị hạn chếkhi còn liên doanh với ericsson sony thường thử nghiệm thiết kế và hình dạng khác nhau cho điện thoại thế nhưng từ khi hoạt động độc lập họ lại hướng tới những mẫu trông nghiêm túc hơn phù hợp với doanh nhântrong nhiều năm hãng điện tử nhật liên tục ra các dòng xperia gần giống nhau cả về kiểu dáng lẫn trải nghiệm phần mềm và áp dụng từ bản giá rẻ đến cao cấp sự bảo thủ này khiến người dùng cảm thấy nhàm chán và dần chuyển sang iphone hoặc những mẫu android đa dạng hơnsony cũng có một vài nỗ lực đổi mới đáng chú ý nhất là tablet p - máy tính bảng năm 2011 có hai màn hình có thể gập lại tuy vậy công nghệ khi đó chưa đủ để nó hữu dụng trong thực tế khiến sản phẩm bị khai tử sau một thời gian ngắnmột trong những lợi thế của sony là khả năng chụp ảnh hãng có hẳn một công ty con chuyên sản xuất cảm biến máy ảnh cho rất nhiều smartphone hiện nay có cả iphone xs maxtrong thời gian dài sony đặt cược vào cảm biến 23 megapixel trên xperia trong khi các đối thủ như samsung htc apple dùng cảm biến 12 megapixel không ít người nghĩ rằng công ty nhật đang nắm lợi thế nhưng thực tế là cảm biến độ phân giải 12 chấm cho hình ảnh với độ nhiễu kỹ thuật số thấp hơn từ đó ảnh chụp rõ ràng hơn dù số pixel thấp hơn việc không sử dụng chống rung quang học ois khá lâu cũng như ưu tiên một số tính năng kém thiết thực như quay video 960 khung hình/giây cũng làm cho smartphone xperia mất lợi thế trước đối thủsony còn chậm thích ứng với xu hướng thị trường chiếc flagship màn hình oled đầu tiên của họ xuất hiện năm ngoái dù các nhà sản xuất khác khác có từ lâu cũng phải đến 2018 thiết kế viền mỏng mới được sony áp dụng sau thời gian dài trung thành với thiết bị có viền trên và dưới dày cộm chưa kể họ còn loại bỏ giắc cắm tai nghe đồng nghĩa khả năng nghe nhạc - điều từng là niềm tự hào trong quá khứ - bị hạn chếtừ tham vọng trở thành đế chế android sony hiện sản xuất không nhiều smartphone và cũng âm thầm rút lui tại một số thị trường như đông nam á theo báo cáo của sony họ chỉ xuất xưởng khoảng 7 triệu điện thoại năm 2018 tương đương lượng máy bán ra trong hai tuần của ba nhà sản xuất điện thoại hàng đầu thế giới một số chuyên gia cho rằng nguy cơ trở thành htc thứ hai của sony hoàn toàn là điều có thểbảo lâm theo phonearena
Galaxy S10 lộ video thực tế sát ngày ra mắt,
"5 smartphone giá rẻ, pin lớn mới xuất hiện ở Việt Nam",
Vân tay siêu âm sẽ là 'vũ khí' bảo mật mới trên Galaxy S10,điện thoại có máy quét vân tay dưới màn hình đã xuất hiện từ đầu 2018 nhưng công nghệ này vẫn còn một số hạn chế do sử dụng cảm biến quang học nên nó cho tốc độ mở khóa chậm vùng nhận dạng chỉ là một điểm nhỏ độ bảo mật chưa cao đây được xem là lý do samsung không đưa công nghệ này lên galaxy s9 và note9 mà chờ giải pháp mới cho galaxy s10theo droid-life dòng điện thoại mà hãng điện tử hàn quốc sắp ra mắt sẽ tích hợp cảm biến vân tay siêu âm đặt dưới màn hình công nghệ này sử dụng các đầu đọc siêu âm thay cho hệ thống quang học nên người dùng có thể chạm tay lên một vùng màn hình để mở khóa chứ không nhất thiết phải đúng một vị trí cố địnhhơn nữa máy quét siêu âm sẽ ghi lại bản đồ 3d các đường rãnh vân tay chi tiết trên ngón tay nên cho độ an toàn cao hơn tốc độ xác thực bảo mật nhanh hơn công nghệ mới còn hoạt động ngay cả khi ngón tay bị ướt dính bẩn điểm mà ngay cả máy quét vân tay truyền thống cũng không làm đượcmặt trước của galaxy s10 sẽ là màn hình tràn viền infinity-o trong đó cạnh trên và dưới đều rất mỏng nhờ việc đặt camera selfie và cảm biến vân tay dưới màn hình giải pháp này sẽ là câu trả lời của samsung trước thiết kế tai thỏ và công nghệ nhận diện khuôn mặt của iphone hay các smartphone trung quốc khác vốn chỉ dùng cảm biến quang học dưới màn hìnhtuy nhiên vân tay của galaxy s10 sẽ không hoạt động với những tấm dán màn hình thông thường một số công ty phụ kiện đang thử nghiệm miếng dán đục lỗ ở khu vực đặt máy quét vân tay hoặc miếng dán đặc biệt với giá khoảng 20 usd khoảng 465000 đồng có thể tương thích với công nghệ bảo mật mớidòng galaxy s mới sẽ được giới thiệu vào ngày 20/2 tại mỹ trong đó s10 và s10+ dùng cảm biến vân tay siêu âm phiên bản giá thấp galaxy s10e vẫn sử dụng cảm biến thông thường đặt cùng nút nguồn nằm ở cạnh phải máy
Galaxy A50 với cảm biến vân tay dưới màn hình lộ diện,theo pricekart galaxy a50 sẽ sử dụng thiết kế màn hình dạng infinity-u rộng 64 inch tấm nền viền mỏng super amoled lần đầu tiên cảm biến vân tay dưới màn hình sẽ được samsung đưa lên một mẫu tầm trung hãng hàn quốc chưa từng tích hợp cảm biến mới trên smartphone nào nhưng dự kiến galaxy s10 ra mắt ngày 20/2 có tính năng nàymáy được trang bị hệ thống camera sau ba ống kính đặt dọc tương tự galaxy a7 2018 nhưng thông số tốt hơn với cảm biến 25 megapixel 5 megapixel và 8 megapixel camera trước cũng có độ phân giải lên tới 25 megapixelgalaxy a50 có hệ thống phím bấm vật lý nằm ở bên phải gồm phím tăng/giảm âm lượng và nguồn phía dưới là cổng usb type c hỗ trợ sạc nhanh giắc cắm tai nghe 35mm nằm bên trái và loa ngoài ở bên phảivới các thông số trên phonearena cho rằng galaxy a50 sẽ là sản phẩm đắt tiền nhất dòng galaxy a trong 2019 hướng tới tầm giá cận cao cấp máy được cho là sẽ ra mắt trong nửa đầu năm nay cùng hai thiết bị tầm trung khác là galaxy a30 và galaxy a10như phúc
iPhone 2019 có thể sạc ngược không dây,theo 9to5mac nhà phân tích ming-chi kuo đã đưa ra một loạt dự đoán mới về các sản phẩm mà apple có thể ra mắt trong năm 2019đầu tiên kuo nói các mẫu iphone năm nay sẽ giữ nguyên kích thước màn hình như bộ ba iphone 2018 là 65 inch 58 inch và 61 inch đồng thời giữ cổng kết nối lightning thay vì chuyển sang usb-cngoài ra các smartphone mới của apple sẽ có kết nối băng tần cực rộng để định vị và điều hướng trong nhà vỏ kính mờ sạc ngược không dây - tính năng đã được huawei thương mại trên mẫu mate 20 pro cho phép biến smartphone thành viên pin dự phòng dự kiến galaxy s10 được công bố tuần này cũng có tính năng tương tựbên cạnh đó face id được nâng cấp với đèn chiếu flood illuminator công suất cao hơn dung lượng pin cũng lớn hơn và có ba camera kuo không nói rõ từng mô hình sẽ có những tính năng gì nhưng các báo cáo trước đây chỉ đề xuất iphone 11 max có ba camerađối với dòng sản phẩm ipad chuyên gia này cho biết apple sẽ giới thiệu hai mẫu ipad pro mới với bộ vi xử lý được nâng cấp ipad 97 inch hiện tại sẽ tăng kích thước lên 102 inch đồng thời giảm kích thước viềnthông tin đáng chú ý khác là cấu hình dòng mac apple sẽ phát hành macbook pro mới có kích thước khoảng 16-165 inch với thiết kế mới macbook pro 13 inch có thể thêm tùy chọn ram 32 gb hiện chỉ phiên bản 15 inch hỗ trợ mức ram này còn mẫu 13 inch có tối đa là ram 16 gb ngoài ra công ty cũng tung ra màn hình 316 inch với chất lượng hiển thị 6k có đèn nền led mini giúp mang lại chất lượng hình ảnh vượt trộikuo nói thêm chức năng apple watch ecg sẽ có mặt tại các quốc gia khác năm nay cùng với một thiết kế vỏ gốm mới cuối cùng ông cho biết airpods 2 dự kiến hỗ trợ sạc không dây và nâng cấp kết nối bluetooth còn sạc airpower sẽ được xuất xưởng trong nửa đầu năm 2019
Samsung sẽ ra ba thiết bị đeo thông minh cùng Galaxy S10,theo verge tên chính thức của loạt thiết bị mới được samsung tiết lộ thông qua ứng dụng galaxy wearable cho android trước đây là samsung gear gồm galaxy watch active galaxy fit/fit e và galaxy budsgalaxy watch active là đồng hồ thông minh từng bị lộ với tên mã pulse có kích thước màn hình 40 mm thay vì 42 mm và 46 mm như galaxy watch thay đổi lớn nhất trên smartwatch này là loại bỏ vòng xoay bezel có từ mẫu gear s2 năm 2015 máy có màn hình tròn 11 inch bộ nhớ 4 gb tích hợp đo nhịp tim hỗ trợ gps và nfc độc lập chống nước ở độ sâu 50 mét và tích hợp trợ lý ảo bixbytrong khi đó galaxy fit và galaxy fit e là hai thiết bị đeo theo dõi sức khỏe thay thế gear fit 2 và gear fit 2 pro thiết kế tương tự sản phẩm của fitbit garmin hay xiaomi theo phonearena hai model này có giá khoảng 100 usd riêng galaxy fit e là phiên bản giá rẻ của galaxy fitcuối cùng là galaxy buds màu trắng trước đó tai nghe này từng lộ ảnh rò rỉ với màu đen pin 58 mah kèm pin trong hộp đựng 252 mah dung lượng này thấp hơn so với gear iconx 2018 82 mah nhưng có thêm tính năng sạc không dây qua điện thoại galaxy s10 galaxy buds có thể phát nhạc cả khi không có điện thoại ở cạnh hoạt động độc lập nhờ 8 gb dung lượng lưu trữ khoảng 2000 bài hát công nghệ bluetooth 50 kháng nước với tiêu chuẩn ipx2 và giá khoảng 200 usddự kiến cả ba sản phẩm ra mắt cùng galaxy s10 ngày 20/2 tại mỹnhư phúc
Galaxy M20 - smartphone có pin lớn nhất của Samsung,
Thế Giới Di Động cùng SaigonTel kinh doanh ổ cứng di động Seagate,theo nhà sản xuất seagate backup plus ultra slim là một trong những dòng ổ cứng di động sở hữu độ mỏng ấn tượng trong khi dung lượng lên đến 2tb đảm bảo cho nhu cầu lưu trữ ngày càng tăng của người dùng kết hợp giữa chất liệu kim loại và nhựa seagate backup plus ultra slim có thiết kế bắt mắt người dùng nhờ kiểu dập lõm vòng tròn đẹp mắt không chỉ hạn chế bám dấu vân tay mà còn tạo cảm giác cầm nắm dễ dàng logo mới của seagate uốn lượn nhẹ nhàng trong khi đó đèn báo tín hiệu được đặt tinh tế trên mặt trướckhông chỉ chú trọng về công nghệ lưu trữ seagate còn đẩy mạnh dịch vụ cứu dữ liệu trên toàn cầu khách hàng khi mua ổ cứng backup plus ultra slim được tặng kèm miễn phí 2 năm dịch vụ cứu dữ liệu hoặc mua thêm với mức giá 499 usd cho thời hạn 1 năm seagate recovery service cho phép khách hàng được phép xem trước những dữ liệu cứu được trước khi thanh toán cũng như theo dõi quá trình dữ liệu được xử lý bằng email cá nhânđại diện thế giới di động cho biết sự kiện bắt tay với công ty cổ phần phân phối và dịch vụ saigontel để tiến hành phân phối dòng sản phẩm seagate backup plus ultra slim là một bước đi đúng đắn theo đó sự phổ biến và thế mạnh của thế giới di động sẽ giúp khách hàng dễ dàng tiếp cận sản phẩm chất lượng trong khi đó seagate backup plus ultra slim có thể đáp ứng nhu cầu về ngoại hình và chất lượng cho người dùnghãng cũng cho biết sẽ cung cấp 2 năm dịch vụ cứu dữ liệu giúp người dùng an tâm khi sử dụng
