"Smartphone camera 48 'chấm' giá chỉ 3,9 triệu đồng",
iPhone XR mất giá chục triệu đồng chỉ sau nửa năm,khi đem bán lại hai chiếc iphone xr 64 gb được người thân gửi về từ mỹ ngọc diệp tây hồ hà nội bất ngờ khi chỉ được các cửa hàng trả 15 16 triệu đồng mỗi máy chị diệp than thở không ngờ giá iphone xr thấp thế bán đi còn bị lỗ tới 2 3 triệu đồngxuất hiện ở việt nam cuối tháng 10 năm ngoái iphone xr khi đó đã được một số cửa hàng xách tay chào bán với mức giá lên tới gần 25 triệu đồng cho phiên bản 64 gb một tháng sau sản phẩm này cũng lên kệ chính hãng với niêm yết lên tới 23 triệu đồng cao hơn nhiều smartphone android cao cấp nhưng sau gần nửa năm xuất hiện trên cả kệ hàng chính hãng lẫn xách tay giá của iphone xr đã rớt rất sâuvới hàng chính hãng giá bán của iphone xr giữa tháng 3 chỉ còn lần lượt 18 198 và 216 triệu đồng cho các phiên bản dung lượng 64 128 và 256 gb nếu so với thời điểm trước tết giá của cả ba model đều giảm khoảng 1 triệu đồng tại các siêu thị lớn iphone xr cũng thường xuyên nằm trong nhóm sản phẩm được giảm giá ưu đãi lớntrên thị trường xách tay tình cảnh của iphone xr không khá khẩm hơn khi giá lao dốc và giờ đã giảm xuống mức thấp nhất trong vòng nửa năm có mặt ở việt nam với xr 64 gb phiên bản ll từ thị trường mỹ một số cửa hàng ở hà nội sáng nay 21/3 bán chỉ 17 triệu đồng trong khi đó nếu mua từ apple store mỹ và chưa cộng thuế bán lẻ số tiền mà người dùng phải bỏ ra cho model này đã gần 174 triệu đồng 749 usd tại các apple store ở gần việt nam như tại thái lan singapore hay hong kong giá mẫu này đều đắt hơn vài triệu đồng so với giá hàng xách tay trong nướckhông có người mua khiến cho iphone xr mất giá mạnh ở việt nam chỉ trong vòng nửa năm tỷ lệ khách hàng chọn model này rất thấp chỉ khoảng 5 đến 10% nếu so với iphone xs và xs max đoàn dũng giám đốc một hệ thống phân phối đồ apple ở hà nội chia sẻvới đà giảm giá sâu gần đây và sức tiêu thụ không được cải thiện xr dễ đi theo vết xe đổ của iphone 5c trước kia và có thể nhiều cửa hàng sẽ tạm ngừng kinh doanh hàng mới và chuyển sang loại đã qua sử dụng anh dũng chia sẻthực tế tại thị trường hà nội một số cửa hàng kinh doanh iphone xách tay đã bắt đầu chào bán iphone xr qua sử dụng thay thế cho hàng mới dù sản phẩm có mặt trên thị trường chưa đầy nửa nămgiống các mẫu iphone trước xr hàng lướt 99% và qua sử dụng đa phần có nguồn gốc từ thị trường mỹ và vẫn còn trong thời gian bảo hành của apple chúng có hình thức bên ngoài khá mới nhưng chỉ gồm máy cáp và sạc không có đủ hộp đựng giá của loại hàng này cũng rẻ hơn khá nhiều so với máy mới xách tay và chính hãng như phiên bản 64 gb chưa tới 15 triệu đồng
So sánh AirPods 2019 mới trình làng với đời đầu,
Chủ kênh YouTube 'triệu view' hành hạ trẻ em để kiếm tiền,kênh youtube fantastic adventures hiện thu hút hơn 800000 lượt theo dõi với nội dung mô tả về một gia đình trẻ em phải chiến đấu với kẻ xấu để bảo vệ công lý nhưng trong đời thực những đứa trẻ này lại bị mẹ nuôi của chúng ngược đãi khủng khiếp như nhốt trong tủ quần áo nhiều ngày bỏ đói hay thậm chí hành hạ bằng bình xịt hơi caytheo gizmodo fantastic adventures được điều hành bởi machelle hackney 48 tuổi sống tại maricopa bang arizona mỹ với số lượng đăng ký và video khổng lồ kênh đang nhận khoảng hơn 250 triệu lượt xem trung bình mỗi clip thời lượng 10-15 phút được xem vài triệu lần mang đến số tiền ước tính hàng trăm nghìn usd mỗi thángtuy nhiên theo guardian hackney và hai người con ruột trưởng thành bị cảnh sát bắt giữ hôm 15/3 bà ta bị buộc hai tội lạm dụng trẻ em năm tội bỏ bê trẻ em năm tội giam giữ bất hợp pháp và bảy tội bạo hành trẻ em hai con trai tên ryan và logan cũng bị buộc tội vì không báo cáo hành động sai trái của mẹ mìnhhackney bị bắt sau khi chính con gái ruột của người này báo cảnh sát hôm 13/3 cho biết mẹ mình đã ngược đãi con nuôi trong nhiều ngày cơ quan thực thi pháp luật của mỹ lập tức khám nhà và phát hiện những đứa trẻ trong tủ quần áo với khuôn mặt nhợt nhạt suy dinh dưỡng và rất đói khát nước một bé trai trong đó còn cho biết đã đau đớn 4-5 ngày khi bị xịt hơi cay từ đầu đến chântrong lúc nói chuyện với cảnh sát một đứa bé trong đó đã uống hết 3 chai nước trong vòng 16 phút vì quá khát tuy nhiên chúng không dám ăn đồ ăn vì sợ hackney phát hiệnkhám xét phòng bà ta cảnh sát cũng thu được bình xịt hơi cay trong lời khai sau đó nạn nhân cho biết còn bị bắt tắm trong nước đá và dìm đầu vào bồn tắm nếu chúng không làm theo lời bà hoặc quên lời thoại khi quay videotrong khi đó hackney phủ nhận việc sử dụng bình xịt hơi cay hay tắm trong nước đá chỉ thừa nhận phạt những đứa bé bằng cách đánh đòn hay đứng vào góc tường người này cũng phủ nhận nhốt trẻ vào phòng riêng hay tủ quần áophía youtube đã xóa kênh fantastic adventures tuy nhiên mạng video này đã phản ứng khá chậm khi mãi tới 20/3 tức gần một tuần sau mới loại nó khỏi hệ thống chúng tôi đã hợp tác chặt chẽ với các tổ chức bảo vệ trẻ em và nhiều cơ quan khác để bảo vệ những người trẻ tuổi khi xác định tính chất nghiêm trọng của vụ việc chúng tôi sẽ hành động bằng cách tạm ngừng kiếm tiền hoặc chấm dứt đối với kênh sau khi có kết quả điều tra một phát ngôn viên youtube cho biếtyoutube không cung cấp số liệu về doanh thu kênh theo socialblade một website chuyên theo dõi số liệu của youtube ước tính fantastic adventures có thể kiếm được 8900 - 142400 usd một thángbảo lâm
AI biến nét vẽ nguệch ngoạc thành tranh nghệ thuật,
Công dân am hiểu công nghệ sẽ tạo nên một xã hội thông minh,hai yếu tố quan trong nhất trong xã hội thụy điển là sự cởi mở và tính minh bạch 94% người thụy điển sử dụng internet với tốc độ kết nối nhanh nhất thế giới việc ứng dụng rộng rãi công nghệ và internet đã giúp thụy điển thúc đẩy văn hóa cởi mở tiếp cận thông tin đổi mới sáng tạo và tinh thần khởi nghiệp nhờ đó tạo ra những phát minh sự tăng trưởng và thịnh vượng cho đất nước thụy điển như ngày hôm nay một xã hội thông minh chỉ có thể đạt được khi có những công dân thông minh và am hiểu công nghệ đại sứ thụy điển pereric högberg chia sẻ tại diễn đàn internet việt nam 2019 vif19 diễn ra tại hà nộisự kiện vif19 năm nay có chủ đề công nghệ số cho những điều tốt đẹp diễn ra trong hai ngày 20 và 21/3 theo bà caitlin wiesen quyền đại diện thường trú của chương trình phát triển liên hiệp quốc undp tại việt nam trên khắp thế giới chính những thanh niên mong muốn đổi mới sáng tạo là những người đã ứng dụng công nghệ mới và mạng internet trong xây dựng xã hội kết nối thanh niên đổi mới sáng tạo là chìa khóa giúp đạt được mục tiêu phát triển bền vững vào năm 2030ông vũ thế bình tổng tổng thư kí hiệp hội internet việt nam via cho biết hiện tỷ lệ sử dụng internet tại việt nam là 60% trong tổng số 95 triệu dân bên cạnh sự phát triển mạnh mẽ về hạ tầng kỹ thuật công nghệ phục vụ các nhu cầu kết nối việt nam cũng đang phải đối mặt với thách thức trong việc nhận diện và hài hòa một số vấn đề xã hội và pháp lý phát sinh từ các ứng dụng công nghệ mới trên nền tảng internettrong khi đó theo ông micheal croft đại diện unesco tại việt nam diễn đàn internet việt nam là cách để các bên chứng kiến cuộc cách mạng công nghệ số đang diễn ra tại việt nam cũng như các cơ hội và thách thức mà cuộc cách mạng này đem lạithách thức với từng cá nhân tổ chức là thành tựu công nghệ đã cho phép sản xuất các video hình ảnh một cách dễ dàng hơn đồng thời cũng gây khó khăn cho mọi người trong việc xác định được giữa thực và hư các nhà báo cũng như những người làm trong ngành báo chí cũng đã thừa nhận thách thức này đặc biệt là trong thế giới số ngày nay nhà báo sẽ gặp rất nhiều khó khăn trong việc giữ gìn sự chính trực liêm chính của mình ông croft nói thêmdiễn dàn internet việt nam do đại sứ quán thụy điển và ủy ban nhân dân hà nội tổ chức là nơi để đại diện cơ quan chính phủ lãnh đạo doanh nghiệp giới học thuật doanh nghiệp xã hội tổ chức phi chính phủ và các nhà đầu tư kết nối và bàn luận về cách thức internet có thể đóng góp cho một xã hội tiến bộ và sáng tạo
Màn hình máy tính Samsung Space có phong cách tối giản,
Apple có thể khai tử 'tai thỏ' trên iPhone 2020,theo etnews apple sẽ có một cuộc cải tổ lớn cho iphone trong năm 2020 khi loại bỏ hoàn toàn màn hình lcd và thay thế bằng oled máy sẽ vẫn có ba phiên bản với kích thước 58 inch 606 inch và 64 inch nhưng nhiều khả năng phần notch khu vực để camera trước và cảm biến sẽ không còn nữatuy nhiên chất lượng của tấm nền oled đời mới cũng không giống nhau nếu như hai phiên bản 58 inch và 64 inch dùng công nghệ cảm ứng đắt tiền mẫu 606 inch chỉ được trang bị lớp cảm ứng đời cũ để tiết kiệm chi phínguồn tin cũng cho biết iphone 2020 có thể sẽ có cảm biến vân tay dưới màn hình camera trước dạng đục lỗ như galaxy s10 hoặc thậm chí nằm bên dưới tấm nền riêng máy ảnh truedepth sẽ có thiết kế nhỏ hơn có khả năng nhận dạng bằng cách xuyên qua lớp màng mỏngcùng với việc trang bị hoàn toàn oled apple có thể sẽ đa dạng hóa các nhà cung cấp thay vì phụ thuộc vào samsung lg display và boe sẽ là hai đối tác phụ bên cạnh công ty điện tử hàn quốctrong khi đó iphone 2019 có ba phiên bản vẫn còn notch nhưng kích thước bộ phận này sẽ được thu hẹp đáng kể một trong ba phiên bản dùng lcd trong khi hai thiết bị còn lại sử dụng oled do samsung sản xuấtbảo lâm
Tim Cook dùng AirPods 2 trở thành chủ đề chế ảnh,apple đã giới thiệu ipad mini mới ngày 19/3 và airpods 2 ngày 20/3 để quảng bá cho hai sản phẩm này ceo tim cook đã đăng trên twitter cá nhân hình ảnh ông dùng máy tính bảng tai nghe không dây mới và nó lập tức trở thành khuôn cho các bức ảnh chế
Samsung trang trí cửa hàng bằng 1.000 smartphone Galaxy,tòa nhà được thiết kế bởi nghệ sĩ nhật bản tokyujin yoshioka nhìn từ bên ngoài những chiếc smartphone dường như đang trôi nổi trên không trung hoặc hiện lên như hình ba chiều trên kínhtuy nhiên đây chỉ là một thủ thuật để đánh lừa về thị giác thực tế những chiếc smartphone được gắn vào mặt bên dưới của một giá đỡ đặt ngang sau đó phản chiếu hình ảnh lên mặt kính đặt vuông góc bên dướitheo fastcompany cả samsung và yoshioka đang muốn tạo ra sự phá cách trong thiết kế smartphone cũng như kiến trúc khi hướng tới việc quan tâm đến hiệu ứng hình ảnh hơn chức năngđối với samsung nó giống như một tuyên bố mình là một công ty sáng tạo luôn muốn tìm ra cách thể hiện riêng dù thường xuyên bị đánh giá là sao chép apple còn tác phẩm của yoshioka cũng gợi mở ý tưởng cho các nhà kiến trúc việc trong tương lai không xa khi màn hình smartphone ngày càng rẻ và phổ biến chúng hoàn toàn có thể được áp dụng vào việc trang trí cho các tòa nhà hiện đại
Kiểm duyệt nội dung Facebook là nghề nguy hiểm,theo the verge cựu giám đốc an ninh của facebook alex stamos đã xuất hiện trên sân khấu của sự kiện south x southwest 2019 mới đây để thảo luận về các vấn đề khó khăn của mạng xã hội này trong đó ông nhấn mạnh việc cần phải chăm lo tốt hơn về sức khỏe tinh thần cho những người điều hành và kiểm duyệt nội dungnói về kiểm duyệt nội dung bạn phải suy nghĩ về những tác động sức khỏe tâm thần mà họ phải đối mặt là gì stamos nói tôi không có bất kỳ nhân viên nào là người kiểm duyệt nội dung nhưng có một đội bảo vệ an toàn cho trẻ em và một đội về chống khủng bố rõ ràng tác động về mặt cảm xúc và tâm lý đối với mọi người là khá cực đoantheo cựu giám đốc an ninh này những người làm công việc kiểm duyệt nội dung cần được trả tiền cũng như nhận các ưu đãi nhiều hơn tuy nhiên vấn đề cơ bản ở các công ty lớn là thường thuê bên thứ ba để phụ trách việc này những công ty chuyên trách sẽ cung cấp đội ngũ kiểm duyệt nội dung và việc hỗ trợ họ cả về vật chất lẫn tinh thần đều thông qua một hàng rào hợp đồng giữa hai bên các điều khoản này hầu hết đều khá khắt khe hạn chế quyền lợi mà những người kiểm duyệt nội dung được hưởngvề lâu dài điều này sẽ làm giảm sự tăng trưởng cũng như chất lượng của dịch vụ này theo stamos facebook cần phải biến đây thành một công việc toàn thời gian để có chế độ hỗ trợ đặc biệt với những người thường xuyên tiếp xúc với các nội dung có nguy cơ cao như quấy rối hay bắt nạt trẻ emcả ngày nhìn vào những video khủng bố hay bạo lực có thể làm bạn bối rối đã có một số nghiên cứu tâm lý về những người làm việc trong lĩnh vực này đàn ông trở nên có xu hướng bạo lực trong gia đình phụ nữ cũng dễ bị ảnh hưởng dù ít hơn vì vậy tôi nghĩ công ty cần có trách nhiệm giúp đỡ ông nóituy nhiên luật pháp hiện nay vẫn tạo ra kẽ hở cho các công ty lảng tránh trách nhiệm đôi khi họ chỉ cần thuê một nhà tâm lý học hoặc bác sĩ tâm thần để ai có nhu cầu sẽ tìm tới nói chuyện các gói bảo hiểm cho nhân viên cũng không có nội dung rõ ràng về các tổn thương và chi phí chữa trị bệnh về tinh thần
"Google bị phạt 1,7 tỷ USD vì cạnh tranh không lành mạnh",theo cnn án phạt được đưa ra hôm qua 20/3 yêu cầu google trả 15 tỷ euro tương đương 17 tỷ usd vì lợi dụng quyền lực để cạnh tranh không lành mạnhủy viên margrethe vestager của liên minh châu âu eu nói google đã củng cố sự thống trị của mình và bảo vệ bản thân khỏi áp lực cạnh tranh bằng cách áp đặt các điều khoản hạn chế trong hợp đồng adsense đối với những trang web khácadsense là một sản phẩm của google hoạt động như một đơn vị trung gian giữa các nhà quảng cáo và chủ sở hữu trang web muốn kiếm lợi nhuận từ không gian xung quanh các trang kết quả tìm kiếm của họbà vestager nói hành vi sai trái này đã kéo dài trong suốt 10 năm thời hạn này được phản ánh trong số tiền phạt khổng lồ google phải chịu để so sánh lợi nhuận của google là gần 31 tỷ usd trong năm 2018 ủy ban cho biết google đã ngừng hành vi bất hợp pháp sau khi cơ quan quản lý gửi cho họ tuyên bố phản đối vào tháng 7/2016các nhà quản lý của eu đã thể hiện thái độ cứng rắn cũng như áp dụng các biện pháp mạnh mẽ với các công ty công nghệ lớn đặc biệt trong vấn đề cạnh tranh bảo vệ dữ liệu và thuếđây là lần thứ ba google phải nhận hình phạt với số tiền lên tới con số hàng tỷ usd tháng 7/2018 eu đã yêu cầu công ty trả 434 tỷ euro khoảng 49 tỷ usd vì đã đẩy các ứng dụng của mình lên smartphone của người dùng và cản trở các đối thủ cạnh tranh trước đó công ty này đã phải đóng khoản tiền phạt 24 tỷ euro khoảng 27 tỷ usd vì đã sử dụng công cụ tìm kiếm của mình để hướng người tiêu dùng đến nền tảng mua sắm riêngtổng cộng kể từ năm 2017 google đã bị liên minh châu âu phạt 82 tỷ euro khoảng 93 tỷ usd số tiền phạt sẽ được trao cho các quốc gia thành viên eu nhưng bà vestager cũng báo hiệu google có thể phải đối mặt với nhiều cuộc điều tra hơn bởi khiếu nại vẫn tiếp tục đếnđáp lại trong một tuyên bố trên blog google cho biết đã thực hiện một loạt các thay đổi cho các sản phẩm của mình để giải quyết các mối quan tâm của ủy bantrong vài tháng tới chúng tôi sẽ cập nhật để cung cấp thêm khả năng hiển thị cho các đối thủ cạnh tranh ở châu âu kent walker phó chủ tịch cấp cao về các vấn đề toàn cầu tại google nóihiện google đã bắt đầu thử nghiệm một định dạng mới cung cấp cho người dùng các liên kết trực tiếp để so sánh các trang web mua sắm hệ thống cũng sẽ hỏi người dùng android cũ lẫn mới ở châu âu muốn sử dụng trình duyệt nào
TV thông minh Coocaa giảm giá sâu dịp sinh nhật Lazada,nhân dịp sinh nhật lazada triển khai chương trình ưu đãi lớn nhất năm cho các sản phẩm tv thông minh của thương hiệu coocaa cụ thể trong ba ngày từ 27-29/3 khách hàng đặt mua android tv và smarttv từ thương hiệu tv bán chạy nhất indonesia sẽ nhận mức giảm giá đến 40% khi áp dụng đồng thời voucher và flash saletheo đại diện hãng tv người dùng có thể nhận voucher giảm lên đến một triệu đồng từ 21-26/3 trong giai đoạn ba ngày diễn ra sinh nhật lazada các sản phẩm sẽ giảm giá mạnh đặc biệt vào khung giờ flash sale mức giá sẽ ưu đãi tối đasau khi áp dụng ưu đãi kép gồm voucher và flash sale người dùng có thể sở hữu các sản phẩm tv công nghệ cao ở mức giá rất tốt so với ngày thường vị đại diện này nhấn mạnhtheo đó android tv 40s5g màn hình 40 inch giá 899 triệu đồng giảm còn 499 triệu đồng; android tv 50s5g màn hình 50 inch giá 1399 triệu đồng giảm còn 799 triệu đồng; android tv 55s5g màn hình 55 inch giá 1899 triệu đồng giảm còn 1099 triệu đồngcác sản phẩm vận hành trên hệ điều hành android 80 đây là nền tảng thông minh mới nhất của google dành cho tv phiên bản mới có thiết kế được nhiều người đánh giá là trực quan dễ sử dụng đồng thời hỗ trợ google assistant với micro tích hợp trên remote để người dùng tìm kiếm bằng giọng nói hỗ trợ nhận dạng chính xác với giọng của cả ba miền bắc - trung - nam tv coocaa có trải nghiệm mượt nhờ mức ram lớn bộ nhớ trong đáp đủ ứng nhu cầu lưu trữ và có thể mở rộng qua bộ nhớ gắn ngoàitrong khi đó đối với dòng smarttv không chạy hệ điều hành android có hai thiết bị khuyến mãi: smart tv 32s5c màn hình 32 inch giá 639 triệu đồng giảm còn 399 triệu đồng; smart tv 40s5c màn hình 40 inch giá 799 triệu đồng giảm còn 469 triệu đồngvới khoản chi phí chưa đến 5 triệu đồng người dùng có thể sở hữu chiếc tv màn hình tràn viền đến 97% diện tích mặt trước thiết kế này có được nhờ coocaa áp dụng công nghệ mở khóa khung viền hai cạnh bên và cạnh trên cùng của sản phẩm gần như được loại bỏvới những ưu thế về công nghệ và mức giá cạnh tranh coocaa dù chỉ xuất hiện tại thị trường việt nam vào tháng 12/2018 nhanh chóng đón nhận những tín hiệu tích cực về doanh số bán hàngtheo thương hiệu công bố smart tv của cooca bán chạy nhất trên lazada đông nam á năm 2018 đồng thời là một trong những thương hiệu thuộc ngành điện gia dụng bán chạy nhất trên lazada việt nam năm 2018 hơn 5000 chiếc tv bán ra chỉ trong 3 ngày khi coocaa ra mắt tại việt nam vào cuối năm 2018coocaa là nhãn hiệu toàn cầu thuộc skyworth - một trong tám nhà sản xuất tv lớn nhất trên thế giới tháng 8 năm nay thương hiệu này ra mắt thị trường indonesia và sau chưa đầy 24 giờ đã có hơn 5000 đơn hàng đại diện hãng này chia sẻ trong ngày 11/11 coocaa tiếp tục nâng doanh số khi bán được 6000 sản phẩm trong 24 giờ với 40% là dòng tv thông minhvới kết quả trên coocaa là nhãn hiệu tv đứng đầu danh sách bán hàng ở hạng mục thiết bị gia đình của lazada indonesia và đứng thứ năm toàn đông nam á ngoài việc mở rộng bán hàng sự quan tâm của người dùng với tv coocaa cũng tăng lên khi lọt top năm thương hiệu gia dụng được tìm kiếm nhiều nhất trên lazada indonesiabảo an
Tác giả ảnh đoạt giải 120.000 USD khẳng định không dàn dựng,trong cuộc phỏng vấn với the star online malaysia nhiếp ảnh gia edwin ong wee kee - người chiến thắng trong cuộc thi nhiếp ảnh quốc tế hamdan hipa - cho hay tác phẩm của ông không dàn dựng ông khẳng định những gì chụp được là hoàn toàn tự nhiêntrong chuyến đi tới việt nam chúng tôi gồm các nhiếp ảnh gia khác đã đến cánh đồng lúa cùng lúc đó một người mẹ cùng đứa con đi ngang qua kee kể lại sau đó tôi hỏi rằng liệu chúng tôi có thể chụp cô ấy được không người phụ nữ đồng ý và bắt đầu ngồi xuốngchúng tôi không bao giờ bảo cô ấy đứng lên hay ngồi xuống ngay cả sau khi chụp ảnh cô ấy vẫn ở đó và không di chuyển cho đến khi nhóm rời đi tác giả bức ảnh đoạt giải 120000 usd khẳng địnhha lee một nhiếp ảnh gia người malaysia khác đi cùng nhóm với kee cũng cho biết tình huống xảy ra tự nhiên nó là hành động tự phát ngẫu hứng và không được sắp xếp trước mẹ con người phụ nữ rất thân thiện lee nói việc buộc tội bức ảnh được dàn dựng không làm chúng tôi buồn bởi còn có rất nhiều nhiếp ảnh gia khác chứng kiếnông kee cho biết đã gửi cả ảnh thô và sau khi chỉnh sửa cho ban giám khảo hipa là cuộc thi lớn nơi họ ban giám khảo có các quy trình chấm điểm gắt gao họ phải đối chứng ảnh gốc và ảnh chỉnh sửa mới trao giải kee nói thêmngày 12/3 tại dubai hipa đã trao giải nhất cho tác phẩm nói về người mẹ khuyết tật ôm con của tác giả kee tuy nhiên bức ảnh hậu trường đăng bởi người sáng lập tạp chí street photo bd khiến nhiều nhiếp ảnh gia khác cho rằng bức ảnh có sự dàn dựng dù ban tổ chức không có bất kỳ quy định nào về việc phải dùng ảnh dàn dựng hay chụp tự nhiên nó vẫn khiến không ít người cảm thấy không công bằngbảo lâm
